{
    "$schema": "http://json-schema.org/draft-07/schema#",
    "title": "Dinosaur Schema",
    "description": "To validate data for all dinosaurs given similar properties",
    "type": "object",
    "properties": {
        "name": {"type": "string"},
        "dossier": {
            "type": ["object", "null"],
            "properties": {
                "species": {"type": "string"},
                "time": {"type": "string"},
                "diet": {"type": "string"},
                "temperament": {"type": "string"},
                "wild": {"type": "string"},
                "domesticated": {"type": "string"}
            },
            "required": ["species", "time", "diet", "temperament", "wild", "domesticated"]
        },
        "base_stats_growth": {
            "type": "object",
            "properties": {
                "health": {
                    "type": "object",
                    "properties": {
                        "base": {"type": ["number", "null"]},
                        "level_increase": {
                            "type": "object",
                            "properties": {
                                "wild": {"type": ["number", "null"]},
                                "tamed": {"type": ["number", "null"]}
                            }
                        },
                        "taming_bonus": {
                            "type": "object",
                            "properties": {
                                "additive": {"type": ["number", "null"] },
                                "multiplicative": { "type": ["number", "null"] }
                            }
                        }
                    }
                },
                "stamina": {
                    "type": "object",
                    "properties": {
                        "base": {"type": ["number", "null"]},
                        "level_increase": {
                            "type": "object",
                            "properties": {
                                "wild": {"type": ["number", "null"]},
                                "tamed": {"type": ["number", "null"]}
                            }
                        },
                        "taming_bonus": {
                            "type": "object",
                            "properties": {
                                "additive": {"type": ["number", "null"] },
                                "multiplicative": { "type": ["number", "null"] }
                            }
                        }
                    }
                },
                "oxygen": {
                    "type": "object",
                    "properties": {
                        "base": {"type": ["number", "null"]},
                        "level_increase": {
                            "type": "object",
                            "properties": {
                                "wild": {"type": ["number", "null"]},
                                "tamed": {"type": ["number", "null"]}
                            }
                        },
                        "taming_bonus": {
                            "type": "object",
                            "properties": {
                                "additive": {"type": ["number", "null"] },
                                "multiplicative": { "type": ["number", "null"] }
                            }
                        }
                    }
                },
                "food": {
                    "type": "object",
                    "properties": {
                        "base": {"type": ["number", "null"]},
                        "level_increase": {
                            "type": "object",
                            "properties": {
                                "wild": {"type": ["number", "null"]},
                                "tamed": {"type": ["number", "null"]}
                            }
                        },
                        "taming_bonus": {
                            "type": "object",
                            "properties": {
                                "additive": {"type": ["number", "null"] },
                                "multiplicative": { "type": ["number", "null"] }
                            }
                        }
                    }
                },
                "weight": {
                    "type": "object",
                    "properties": {
                        "base": {"type": ["number", "null"]},
                        "level_increase": {
                            "type": "object",
                            "properties": {
                                "wild": {"type": ["number", "null"]},
                                "tamed": {"type": ["number", "null"]}
                            }
                        },
                        "taming_bonus": {
                            "type": "object",
                            "properties": {
                                "additive": {"type": ["number", "null"] },
                                "multiplicative": { "type": ["number", "null"] }
                            }
                        }
                    }
                },
                "melee": {
                    "type": "object",
                    "properties": {
                        "base": {"type": ["number", "null"]},
                        "level_increase": {
                            "type": "object",
                            "properties": {
                                "wild": {"type": ["number", "null"]},
                                "tamed": {"type": ["number", "null"]}
                            }
                        },
                        "taming_bonus": {
                            "type": "object",
                            "properties": {
                                "additive": {"type": ["number", "null"] },
                                "multiplicative": { "type": ["number", "null"] }
                            }
                        }
                    }
                },
                "movement": {
                    "type": "object",
                    "properties": {
                        "base": {"type": ["number", "null"]},
                        "level_increase": {
                            "type": "object",
                            "properties": {
                                "wild": {"type": ["number", "null"]},
                                "tamed": {"type": ["number", "null"]}
                            }
                        },
                        "taming_bonus": {
                            "type": "object",
                            "properties": {
                                "additive": {"type": ["number", "null"] },
                                "multiplicative": { "type": ["number", "null"] }
                            }
                        }
                    }
                },
                "torpidity": {
                    "type": "object",
                    "properties": {
                        "base": {"type": ["number", "null"]},
                        "level_increase": {
                            "type": "object",
                            "properties": {
                                "wild": {"type": ["number", "null"]},
                                "tamed": {"type": ["number", "null"]}
                            }
                        },
                        "taming_bonus": {
                            "type": "object",
                            "properties": {
                                "additive": {"type": ["number", "null"] },
                                "multiplicative": { "type": ["number", "null"] }
                            }
                        }
                    }
                }
            },
            "required": ["health", "stamina", "oxygen", "food", "weight", "melee", "movement", "torpidity"]
        },
        "tameable": {"type": "boolean"},
        "rideable": {"type": "boolean"},
        "breedable": {"type": "boolean"},
        "taming": {
            "type": ["object", "null"],
            "properties": {
                "method": {"type": ["string", "null"]},
                "kibble": {"type": ["string", "null"]}
            },
            "required": ["method", "kibble"]
        },
        "saddle": {
            "type": ["array", "object", "null"],
            "properties": {
                "name": {"type": ["string", "null"]},
                "engram_level": {"type": ["integer", "null"]}
            },
            "required": ["name", "engram_level"]
        },
        "rider_weaponry": {"type": "boolean"},
        "egg": {
            "type": ["object", "null"],
            "properties": {
                "name": {"type": ["string", "array"]},
                "incubation": {
                    "type": "object",
                    "properties": {
                        "range": {"type": "string"},
                        "incubation_range": {"type": "string"},
                        "incubation_time": {"type": "string"}
                    },
                    "required": ["range", "incubation_range", "incubation_time"]
                },
                "baby_time": {"type": "string"},
                "juvenile_time": {"type": "string"},
                "adolescent_time": {"type": "string"},
                "total_maturation": {"type": "string"},
                "breeding_interval": {"type": "string"}
            },
            "required": ["name", "incubation", "baby_time", "juvenile_time", "adolescent_time", "total_maturation", "breeding_interval"]
        },
        "drag_weight": {"type": ["number", "null"]},
        "cloneable": {"type": ["boolean", "null"]},
        "entity_id": {"type": ["string", "null"]}
    },
    "required": ["name", "dossier", "base_stats_growth", "tameable", "rideable", "breedable", "taming", "saddle", "rider_weaponry", "egg", "drag_weight", "cloneable", "entity_id"]
}